{
  "kind": "task",
  "schemaVersion": "1.0.0",
  "id": "build-product-task-5",
  "workflowId": "build-product",
  "workflowInstanceId": "build-product-2026-03-14T10-13-01-032Z",
  "sequence": 5,
  "stepId": "testing",
  "agentId": "qa-agent",
  "skillId": "integration-test",
  "artifactName": "verification-report",
  "status": "pending",
  "dependsOnTaskIds": [
    "build-product-task-4"
  ],
  "runIds": [],
  "checkoutRunId": null,
  "executionRunId": null,
  "createdAt": "2026-03-14T10:13:01.032Z",
  "updatedAt": "2026-03-14T10:13:01.032Z",
  "startedAt": null,
  "completedAt": null,
  "artifactFile": null,
  "error": null
}