{
  "kind": "task",
  "schemaVersion": "1.0.0",
  "id": "build-product-task-1",
  "workflowId": "build-product",
  "workflowInstanceId": "build-product-2026-03-14T09-58-29-704Z",
  "sequence": 1,
  "stepId": "idea-analysis",
  "agentId": "ceo-agent",
  "skillId": "opportunity-analysis",
  "artifactName": "opportunity-summary",
  "status": "ready",
  "dependsOnTaskIds": [],
  "runIds": [],
  "checkoutRunId": null,
  "executionRunId": null,
  "createdAt": "2026-03-14T09:58:29.704Z",
  "updatedAt": "2026-03-14T09:58:29.704Z",
  "startedAt": null,
  "completedAt": null,
  "artifactFile": null,
  "error": null
}