{
  "kind": "task",
  "schemaVersion": "1.0.0",
  "id": "build-product-task-4",
  "workflowId": "build-product",
  "workflowInstanceId": "build-product-2026-03-14T08-35-27-128Z",
  "sequence": 4,
  "stepId": "development",
  "agentId": "engineer-agent",
  "skillId": "code-generation",
  "artifactName": "implementation",
  "status": "done",
  "dependsOnTaskIds": [
    "build-product-task-3"
  ],
  "runIds": [
    "build-product-task-4-run-1"
  ],
  "checkoutRunId": "build-product-task-4-run-1",
  "executionRunId": "build-product-task-4-run-1",
  "createdAt": "2026-03-14T08:35:27.128Z",
  "updatedAt": "2026-03-14T08:35:27.169Z",
  "startedAt": "2026-03-14T08:35:27.166Z",
  "completedAt": "2026-03-14T08:35:27.169Z",
  "artifactFile": "tasks/results/build-product-2026-03-14T08-35-27-128Z/04-development.md",
  "error": null
}