{
  "kind": "task",
  "schemaVersion": "1.0.0",
  "id": "build-product-task-3",
  "workflowId": "build-product",
  "workflowInstanceId": "build-product-2026-03-14T08-35-02-930Z",
  "sequence": 3,
  "stepId": "architecture",
  "agentId": "architect-agent",
  "skillId": "system-architecture",
  "artifactName": "architecture-blueprint",
  "status": "pending",
  "dependsOnTaskIds": [
    "build-product-task-2"
  ],
  "runIds": [],
  "checkoutRunId": null,
  "executionRunId": null,
  "createdAt": "2026-03-14T08:35:02.930Z",
  "updatedAt": "2026-03-14T08:35:02.930Z",
  "startedAt": null,
  "completedAt": null,
  "artifactFile": null,
  "error": null
}