{
  "kind": "task",
  "schemaVersion": "1.0.0",
  "id": "build-product-task-4",
  "workflowId": "build-product",
  "workflowInstanceId": "build-product-2026-03-14T08-35-02-930Z",
  "sequence": 4,
  "stepId": "development",
  "agentId": "engineer-agent",
  "skillId": "code-generation",
  "artifactName": "implementation",
  "status": "pending",
  "dependsOnTaskIds": [
    "build-product-task-3"
  ],
  "runIds": [],
  "checkoutRunId": null,
  "executionRunId": null,
  "createdAt": "2026-03-14T08:35:02.930Z",
  "updatedAt": "2026-03-14T08:35:02.930Z",
  "startedAt": null,
  "completedAt": null,
  "artifactFile": null,
  "error": null
}